{
  "id": "flutter_secure_storage",
  "name": "flutter_secure_storage",
  "category": "persistence",
  "summary": "A Flutter plugin for storing sensitive small values using platform-specific secure or encrypted storage mechanisms.",
  "sources": [
    {
      "type": "pub_dev",
      "url": "https://pub.dev/packages/flutter_secure_storage"
    },
    {
      "type": "github",
      "url": "https://github.com/juliansteenbakker/flutter_secure_storage"
    }
  ],
  "latestVersion": "11.2.0",
  "advantages": [
    "Provides a cross-platform API over secure platform storage",
    "Appropriate for small sensitive values such as authentication tokens"
  ],
  "tradeoffs": [
    "Platform backup and keychain or keystore behavior requires platform-specific review",
    "Version 10+ changed Android defaults to RSA-OAEP key wrapping with AES-GCM storage encryption and raised Android minimum SDK to 23",
    "Not a general-purpose database or large-data store"
  ],
  "recommendedFor": [
    "Authentication tokens and credentials",
    "Small security-sensitive values that should not be stored in ordinary preferences"
  ],
  "worksWellWith": [
    "Flutter",
    "platform keychain/keystore facilities"
  ],
  "verification": {
    "status": "verified",
    "context7Required": false,
    "reason": "Current pub.dev metadata and official repository documentation are sufficient for the high-level selection guidance."
  },
  "verifiedAt": "2026-10-05"
}
